{
  "schemaVersion": 1,
  "ledgerEventId": "00000000-0000-4000-8000-000000000001",
  "ownerId": "00000000-0000-4000-8000-000000000002",
  "kind": "meal.logged",
  "derivationKey": "aaaaaaaaaaaaaaaaaaaaaaaaaaaaaaaaaaaaaaaaaaaaaaaaaaaaaaaaaaaaaaaa",
  "derivationVersion": "fixture-v1",
  "revision": 1,
  "startedAt": "2026-09-25T10:00:00Z",
  "endedAt": null,
  "sourceRefs": [
    {
      "schemaVersion": 1,
      "sourceType": "synthetic",
      "sourceId": "fixture-source-1",
      "sourceVersion": "1",
      "occurredAt": "2026-09-25T10:00:00Z",
      "observedAt": "2026-09-25T10:00:00Z",
      "coverage": "fixture only",
      "informationState": "known",
      "sensitivity": "normal",
      "contentHash": null
    }
  ],
  "summary": "Synthetic meal logged",
  "informationState": "known",
  "sensitivity": "private",
  "supersedesId": null
}
